{
  "artifact_digest": "sha256:4cf7c5e4472e227388bb9fed5b87781bc1b8d0833dc699edce96f3116bee28ec",
  "blockers": [
    "source worktree is dirty; candidate is not attributable to its commit"
  ],
  "conditions": [
    "canonical release policy requires its recorded approvals"
  ],
  "container_findings": [
    "FND-CONTAINER-026cbd40a3d8",
    "FND-CONTAINER-3b7728ab6349",
    "FND-CONTAINER-3d855e8b31a4",
    "FND-CONTAINER-43d127b610b8",
    "FND-CONTAINER-452f02c62efd",
    "FND-CONTAINER-4b3599117c60",
    "FND-CONTAINER-5464624f68ba",
    "FND-CONTAINER-54f909a65e8d",
    "FND-CONTAINER-57b96cf12bee",
    "FND-CONTAINER-5a8d530b00be",
    "FND-CONTAINER-6017bcc173f8",
    "FND-CONTAINER-65d0909407ea",
    "FND-CONTAINER-65d75e6eba4f",
    "FND-CONTAINER-6884a6a2aeb3",
    "FND-CONTAINER-6e659fb03bfe",
    "FND-CONTAINER-7401651d82c4",
    "FND-CONTAINER-75484f7ebb4b",
    "FND-CONTAINER-77763b149b4f",
    "FND-CONTAINER-8229cd4d151d",
    "FND-CONTAINER-84d155fdc3d1",
    "FND-CONTAINER-85c29f2e1d67",
    "FND-CONTAINER-866a375b43af",
    "FND-CONTAINER-87e329c9d3c9",
    "FND-CONTAINER-8917d095a4d4",
    "FND-CONTAINER-8c4116b09936",
    "FND-CONTAINER-9448e15df1ef",
    "FND-CONTAINER-97d0d191781c",
    "FND-CONTAINER-a05776d7b2eb",
    "FND-CONTAINER-a44acae763a2",
    "FND-CONTAINER-a6116dba2666",
    "FND-CONTAINER-b11df2b9097e",
    "FND-CONTAINER-b32479e41fff",
    "FND-CONTAINER-b49f58b918ed",
    "FND-CONTAINER-b9d1bbc8febf",
    "FND-CONTAINER-c1e6ced9904f",
    "FND-CONTAINER-c269596a605e",
    "FND-CONTAINER-c29de2c95e6d",
    "FND-CONTAINER-c31d90a0dae9",
    "FND-CONTAINER-cdafc2f07851",
    "FND-CONTAINER-d7e9ab84f9e9",
    "FND-CONTAINER-e1d4cd41e57c",
    "FND-CONTAINER-e1f2cc1c749d",
    "FND-CONTAINER-e9c4b1dd55ff",
    "FND-CONTAINER-f6f763380649"
  ],
  "container_scan_reference": "outputs/security/supply-chain/container-scan-summary.json",
  "provenance_reference": "outputs/security/supply-chain/provenance.json",
  "publication_allowed": false,
  "release_decision": "conditional_pass",
  "release_decision_id": "REL-d65797fa59025938",
  "sbom_reference": "outputs/security/supply-chain/container-sbom.cdx.json",
  "schema_version": "1.0",
  "status": "blocked"
}
